"stat_text","numeric_value","unit","value_type","sample_size","category_id","sentiment","era","selection_bias_flag","semantic_cluster","conflicts_with","source_id","source_title","source_url","source_publisher","credibility_tier","methodology_grade","data_collection_year","published_date"
"The coefficient of variation (CV) for this estimate is between 30 and 50 percent.","30.0","count","","","1","neutral","2020_present","0","","","nces_001","NCES — Homeschooling in the United States","https://nces.ed.gov/programs/digest/d22/tables/dt22_206.10.asp","National Center for Education Statistics","government","A","2020","2022-01-01"
"The percentage of students with an ""ungraded"" grade equivalent was 0.03 percent in 1999 and 0.02 percent in 2003 and 2007.","0.0","count","","","1","neutral","2020_present","0","","","nces_001","NCES — Homeschooling in the United States","https://nces.ed.gov/programs/digest/d22/tables/dt22_206.10.asp","National Center for Education Statistics","government","A","2020","2022-01-01"
"5 For 1999, estimates combine the ""$75,001 to $100,000"" and ""Over $100,000"" categories.","75001.0","USD","","","3","neutral","2020_present","0","","","nces_001","NCES — Homeschooling in the United States","https://nces.ed.gov/programs/digest/d22/tables/dt22_206.10.asp","National Center for Education Statistics","government","A","2020","2022-01-01"
"NOTE: Data in 2019 exclude students who were enrolled in school for more than 24 hours a week, while data prior to 2019 exclude students who were enrolled in school for more than 25 hours a week.","24.0","count","","","1","neutral","2020_present","0","","","nces_001","NCES — Homeschooling in the United States","https://nces.ed.gov/programs/digest/d22/tables/dt22_206.10.asp","National Center for Education Statistics","government","A","2020","2022-01-01"
"Response: Total expenditures for public elementary and secondary schools in the United States were $927 billion in 202021 (in constant 202223 dollars).","927.0","USD","","","3","neutral","2020_present","0","","","nces_003","NCES — Per Pupil Expenditure in Public Schools","https://nces.ed.gov/fastfacts/display.asp?id=66","National Center for Education Statistics","government","A","2021","2023-01-01"
"1 , 2 , 3 This amounts to an average of $18,614 per public school pupil enrolled in the fall of that school year.","18614.0","USD","","","3","neutral","2020_present","0","","","nces_003","NCES — Per Pupil Expenditure in Public Schools","https://nces.ed.gov/fastfacts/display.asp?id=66","National Center for Education Statistics","government","A","2021","2023-01-01"
"In 2020–21, of the $18,614 spent on total expenditures per pupil nationally, current expenditures—which include salaries, employee benefits, purchased services, supplies, tuition, and other expenditures—accounted for $16,280 (87 percent); capital outlay—which includes expenditures for property, buildings, and alterations completed by school district staff or contractors—accounted for $1,833 (10 percent); and interest on school debt accounted for $501 (3 percent).","18614.0","USD","","","3","neutral","2020_present","0","","","nces_003","NCES — Per Pupil Expenditure in Public Schools","https://nces.ed.gov/fastfacts/display.asp?id=66","National Center for Education Statistics","government","A","2021","2023-01-01"
"Average current expenditures per pupil enrolled in the fall in public elementary and secondary schools increased by 13 percent from 2010–11 ($14,453) to 2020–21 ($16,280), after adjusting for inflation.","14453.0","USD","","","3","neutral","2020_present","0","","","nces_003","NCES — Per Pupil Expenditure in Public Schools","https://nces.ed.gov/fastfacts/display.asp?id=66","National Center for Education Statistics","government","A","2021","2023-01-01"
"During this period, current expenditures per pupil were lowest in 2012–13 ($13,952) and then increased each year from 2012–13 to 2020–21.","13952.0","USD","","","3","neutral","2020_present","0","","","nces_003","NCES — Per Pupil Expenditure in Public Schools","https://nces.ed.gov/fastfacts/display.asp?id=66","National Center for Education Statistics","government","A","2021","2023-01-01"
"From 2010–11 to 2020–21, the percentage of current expenditures spent on staff salaries decreased from 59 to 55 percent.","11.0","count","","","3","neutral","2020_present","0","","","nces_003","NCES — Per Pupil Expenditure in Public Schools","https://nces.ed.gov/fastfacts/display.asp?id=66","National Center for Education Statistics","government","A","2021","2023-01-01"
"In contrast, the percentage of current expenditures spent on employee benefits increased from 21 to 24 percent during this period.","21.0","count","","","3","neutral","2020_present","0","","","nces_003","NCES — Per Pupil Expenditure in Public Schools","https://nces.ed.gov/fastfacts/display.asp?id=66","National Center for Education Statistics","government","A","2021","2023-01-01"
"Altogether, salaries and benefits combined accounted for 79 to 80 percent of current expenditures throughout the decade.","79.0","count","","","3","neutral","2020_present","0","","","nces_003","NCES — Per Pupil Expenditure in Public Schools","https://nces.ed.gov/fastfacts/display.asp?id=66","National Center for Education Statistics","government","A","2021","2023-01-01"
"Apart from salaries and benefits, current expenditures in 2020–21 were spent as follows: 11 percent on purchased services, which include items such as contracts for food, transportation, janitorial services, and professional development for teachers; 8 percent on supplies, which range from books to heating oil; and 2 percent combined on tuition and other expenditures.","21.0","count","","","3","neutral","2020_present","0","","","nces_003","NCES — Per Pupil Expenditure in Public Schools","https://nces.ed.gov/fastfacts/display.asp?id=66","National Center for Education Statistics","government","A","2021","2023-01-01"
"The percentage of current expenditures spent on each of these objects in 2020–21 differed by 1 percentage point or less compared with the corresponding percentage in 2010–11.","21.0","count","","","3","neutral","2020_present","0","","","nces_003","NCES — Per Pupil Expenditure in Public Schools","https://nces.ed.gov/fastfacts/display.asp?id=66","National Center for Education Statistics","government","A","2021","2023-01-01"
"Homeschooling on the Rise During COVID-19 Pandemic Homeschooling on the Rise During COVID-19 Pandemic Homeschooling on the Rise During COVID-19 Pandemic Census Bureau’s Household Pulse Survey Shows Significant Increase in Homeschooling Rates in Fall 2020 March 22, 2021 Written by: Casey Eggleston and Jason Fields Homeschooling is a legal instructional option in all 50 states and national homeschooling rates grew rapidly from 1999 to 2012 but had since remained steady at around 3.3%.","3.3","%","","","1","neutral","2020_present","0","","","census_001","Census — Household Pulse Survey, Homeschooling","https://www.census.gov/library/stories/2021/03/homeschooling-on-the-rise-during-covid-19-pandemic.html","U.S. Census Bureau","government","A","2020","2021-03-22"
"Meeting Education, Health Needs In the first week (April 23-May 5) of Phase 1 of the Household Pulse Survey, about 5.4% of U.S.","5.4","%","","","1","neutral","2020_present","0","","","census_001","Census — Household Pulse Survey, Homeschooling","https://www.census.gov/library/stories/2021/03/homeschooling-on-the-rise-during-covid-19-pandemic.html","U.S. Census Bureau","government","A","2020","2021-03-22"
"By fall, 11.1% of households with school-age children reported homeschooling (Sept.","11.1","%","","","1","neutral","2020_present","0","","","census_001","Census — Household Pulse Survey, Homeschooling","https://www.census.gov/library/stories/2021/03/homeschooling-on-the-rise-during-covid-19-pandemic.html","U.S. Census Bureau","government","A","2020","2021-03-22"
"That change represents an increase of 5.6 percentage points and a doubling of U.S.","5.0","count","","","1","neutral","2020_present","0","","","census_001","Census — Household Pulse Survey, Homeschooling","https://www.census.gov/library/stories/2021/03/homeschooling-on-the-rise-during-covid-19-pandemic.html","U.S. Census Bureau","government","A","2020","2021-03-22"
"In households where respondents identified as Black or African American (Table 1), the proportion homeschooling increased by five times, from 3.3% (April 23-May 5) to 16.1% in the fall (Sept.","3.3","%","","","5","neutral","2020_present","0","","","census_001","Census — Household Pulse Survey, Homeschooling","https://www.census.gov/library/stories/2021/03/homeschooling-on-the-rise-during-covid-19-pandemic.html","U.S. Census Bureau","government","A","2020","2021-03-22"
"Massachusetts, for example, jumped from 1.5% to 12.1% while many other states did not show a significant change.","1.5","%","","","1","neutral","2020_present","0","","","census_001","Census — Household Pulse Survey, Homeschooling","https://www.census.gov/library/stories/2021/03/homeschooling-on-the-rise-during-covid-19-pandemic.html","U.S. Census Bureau","government","A","2020","2021-03-22"
"Among the 15 largest Metropolitan Statistical Areas (MSA), for example, the Boston-Cambridge-Newton, MA-NH MSA, went from 0.9% in the spring of 2020 to 8.9% by the fall.","0.9","%","","","1","neutral","2020_present","0","","","census_001","Census — Household Pulse Survey, Homeschooling","https://www.census.gov/library/stories/2021/03/homeschooling-on-the-rise-during-covid-19-pandemic.html","U.S. Census Bureau","government","A","2020","2021-03-22"
"In contrast, the rate in the Seattle-Tacoma-Bellevue, WA, MSA was not significantly different (4.2% and 5.2%) for the same period.","4.2","%","","","1","neutral","2020_present","0","","","census_001","Census — Household Pulse Survey, Homeschooling","https://www.census.gov/library/stories/2021/03/homeschooling-on-the-rise-during-covid-19-pandemic.html","U.S. Census Bureau","government","A","2020","2021-03-22"
"student (public pre-K through 12th grade) was $14,347 and enrollment was 49.6 million.","14347.0","USD","","","3","neutral","2020_present","0","","","census_001","Census — Household Pulse Survey, Homeschooling","https://www.census.gov/library/stories/2021/03/homeschooling-on-the-rise-during-covid-19-pandemic.html","U.S. Census Bureau","government","A","2020","2021-03-22"
"Census Bureau’s Household Pulse Survey shows that nearly 93% of households with school-age children reported engaging in “distance learning” from home.","93.0","%","","","1","neutral","2020_present","0","","","census_001","Census — Household Pulse Survey, Homeschooling","https://www.census.gov/library/stories/2021/03/homeschooling-on-the-rise-during-covid-19-pandemic.html","U.S. Census Bureau","government","A","2020","2021-03-22"
"This is up from 2.5 million in spring 2019 [note 1].","2500000.0","count","","","1","neutral","2012_2019","0","","","nheri_001","NHERI — Academic Achievement Research","https://www.nheri.org/research-facts-on-homeschooling/","National Home Education Research Institute","peer_reviewed","B","2019","2021-01-01"
"The 3.408 million is an estimated 6.262% of the school-age population.","6.262","%","","","1","neutral","2012_2019","0","","","nheri_001","NHERI — Academic Achievement Research","https://www.nheri.org/research-facts-on-homeschooling/","National Home Education Research Institute","peer_reviewed","B","2019","2021-01-01"
"The homeschool population had been growing at an estimated 2% to 8% per annum over the past several years, but it grew drastically from 2019-2020 to 2020-2021.","2.0","%","","","1","neutral","2012_2019","0","","","nheri_001","NHERI — Academic Achievement Research","https://www.nheri.org/research-facts-on-homeschooling/","National Home Education Research Institute","peer_reviewed","B","2019","2021-01-01"
"There were about 3.408 million homeschool students in 2024-2025 in grades K-12 in the United States Roughly 6% of school-age children are educated at home.","6.0","%","","","1","neutral","2012_2019","0","","","nheri_001","NHERI — Academic Achievement Research","https://www.nheri.org/research-facts-on-homeschooling/","National Home Education Research Institute","peer_reviewed","B","2019","2021-01-01"
"One nationwide study shows that 41% of homeschool students are Black, Asian, Hispanic, and others (i.e., not White/non-Hispanic) ( U.S.","41.0","%","","","5","neutral","2012_2019","0","","","nheri_001","NHERI — Academic Achievement Research","https://www.nheri.org/research-facts-on-homeschooling/","National Home Education Research Institute","peer_reviewed","B","2019","2021-01-01"
"Department of Education, 2019 ) It is estimated that over 9 million Americans had experienced being homeschooled as of February of 2020.","9000000.0","count","","","1","neutral","2012_2019","0","","","nheri_001","NHERI — Academic Achievement Research","https://www.nheri.org/research-facts-on-homeschooling/","National Home Education Research Institute","peer_reviewed","B","2019","2021-01-01"
"Taxpayers spend an average of $16,446 per pupil annually in public schools, plus capital expenditures (National Education Association, 2023).","16446.0","USD","","","3","neutral","2012_2019","0","","","nheri_001","NHERI — Academic Achievement Research","https://www.nheri.org/research-facts-on-homeschooling/","National Home Education Research Institute","peer_reviewed","B","2019","2021-01-01"
"The roughly 3.1 million homeschool students of 2021-22 represented a savings of over $51 billion for taxpayers.","51.0","USD","","","3","neutral","2012_2019","0","","","nheri_001","NHERI — Academic Achievement Research","https://www.nheri.org/research-facts-on-homeschooling/","National Home Education Research Institute","peer_reviewed","B","2019","2021-01-01"
"This is $51 billion that American taxpayers did not have to spend.","51.0","USD","","","3","neutral","2012_2019","0","","","nheri_001","NHERI — Academic Achievement Research","https://www.nheri.org/research-facts-on-homeschooling/","National Home Education Research Institute","peer_reviewed","B","2019","2021-01-01"
"Taxpayers spend nothing on the vast majority of homeschool students, while homeschool families spend an average of $600 per student annually for their education.","600.0","USD","","","3","neutral","2012_2019","0","","","nheri_001","NHERI — Academic Achievement Research","https://www.nheri.org/research-facts-on-homeschooling/","National Home Education Research Institute","peer_reviewed","B","2019","2021-01-01"
"Sources: Ray, 2015 and US Department of Education Academic Performance of Homeschooled Students The home-educated typically score 15 to 25 percentile points above public-school students on standardized academic achievement tests ( Ray, 2010 , 2015 , 2017 ; Ray & Hoelzle, 2024).","15.0","count","","","1","neutral","2012_2019","0","","","nheri_001","NHERI — Academic Achievement Research","https://www.nheri.org/research-facts-on-homeschooling/","National Home Education Research Institute","peer_reviewed","B","2019","2021-01-01"
"(The public school average is roughly the 50th percentile; scores range from 1 to 99.) A 2015 study found Black homeschool students to be scoring 23 to 42 percentile points above Black public school students ( Ray, 2015 ).","1.0","count","","","5","neutral","2012_2019","0","","","nheri_001","NHERI — Academic Achievement Research","https://www.nheri.org/research-facts-on-homeschooling/","National Home Education Research Institute","peer_reviewed","B","2019","2021-01-01"
"78% of peer-reviewed studies on academic achievement show homeschool students perform statistically significantly better than those in institutional schools ( Ray, 2017 ) Homeschool students score above average on achievement tests regardless of their parents’ level of formal education or their family’s household income.","78.0","%","","","2","pro_homeschool","2012_2019","0","peer_interaction","","nheri_001","NHERI — Academic Achievement Research","https://www.nheri.org/research-facts-on-homeschooling/","National Home Education Research Institute","peer_reviewed","B","2019","2021-01-01"
"87% of peer-reviewed studies on social, emotional, and psychological development show homeschool students perform statistically significantly better than those in conventional schools ( Ray, 2017 ).","87.0","%","","","2","neutral","2012_2019","0","peer_interaction","","nheri_001","NHERI — Academic Achievement Research","https://www.nheri.org/research-facts-on-homeschooling/","National Home Education Research Institute","peer_reviewed","B","2019","2021-01-01"
"Success in Adulthood 50% of peer-reviewed studies on success into adulthood (including college) show adults who were home educated succeed and perform statistically significantly better than those who attended institutional schools (Ray, 2017, 2023).","50.0","%","","","2","neutral","2012_2019","0","adult_outcomes","","nheri_001","NHERI — Academic Achievement Research","https://www.nheri.org/research-facts-on-homeschooling/","National Home Education Research Institute","peer_reviewed","B","2019","2021-01-01"
"The spring 2019 estimate was based on an estimate of about 2.5% per annum growth from estimates of 2 million home-educated children during the spring of 2010 and 2.3 million spring of 2016 in the United States (Ray, 2011).","2.5","%","","","1","neutral","2012_2019","0","","","nheri_001","NHERI — Academic Achievement Research","https://www.nheri.org/research-facts-on-homeschooling/","National Home Education Research Institute","peer_reviewed","B","2019","2021-01-01"
"The estimate of 2.3 million in 2016 was calculated by Brian D.","2300000.0","count","","","1","neutral","2012_2019","0","","","nheri_001","NHERI — Academic Achievement Research","https://www.nheri.org/research-facts-on-homeschooling/","National Home Education Research Institute","peer_reviewed","B","2019","2021-01-01"
"During 161 fishing events, tuna catches amounted to 147 t: 72% by weight was skipjack, 25% yellowfin tuna ( Thunnus albacares) and 3% other tunas.","72.0","%","","","1","neutral","2012_2019","0","","","plos_001","PLOS ONE — Social Development in Homeschooled vs. Traditionally Schooled Children","https://journals.plos.org/plosone/article?id=10.1371/journal.pone.0177391","PLOS ONE","peer_reviewed","A","2016","2017-05-31"
"Bycatch (all non-tuna species caught plus all tuna discards) amounted to 951 kg (0.65% of total tuna catch).","0.65","%","","","1","neutral","2012_2019","0","","","plos_001","PLOS ONE — Social Development in Homeschooled vs. Traditionally Schooled Children","https://journals.plos.org/plosone/article?id=10.1371/journal.pone.0177391","PLOS ONE","peer_reviewed","A","2016","2017-05-31"
"Most of the bycatch (95%) was utilized, and some bycatch was released alive, so dead discards were particularly low (0.02% of total tuna catch, or 22 kg per 100 t).","95.0","%","","","1","neutral","2012_2019","0","","","plos_001","PLOS ONE — Social Development in Homeschooled vs. Traditionally Schooled Children","https://journals.plos.org/plosone/article?id=10.1371/journal.pone.0177391","PLOS ONE","peer_reviewed","A","2016","2017-05-31"
"Rainbow runner ( Elagatis bipinnulata ) and dolphinfish ( Coryphaena hippurus ) together constituted 93% of the bycatch.","93.0","%","","","1","pro_public","2012_2019","0","","","plos_001","PLOS ONE — Social Development in Homeschooled vs. Traditionally Schooled Children","https://journals.plos.org/plosone/article?id=10.1371/journal.pone.0177391","PLOS ONE","peer_reviewed","A","2016","2017-05-31"
"A recent global review suggested that discards averaged 10.3 Mt per year during 2000–2010 [ 2 ].","10.0","count","","","1","neutral","2012_2019","0","","","plos_001","PLOS ONE — Social Development in Homeschooled vs. Traditionally Schooled Children","https://journals.plos.org/plosone/article?id=10.1371/journal.pone.0177391","PLOS ONE","peer_reviewed","A","2016","2017-05-31"
"Catches of the three main tropical species amounted to 527,447 t in 2015, of which yellowfin tuna ( Thunnus albacares ) accounted for 45%, followed closely by skipjack tuna ( Katsuwonus pelamis ) (44%), and catches of bigeye tuna ( Thunnus obesus ) account for the remaining 11%.","45.0","%","","","1","neutral","2012_2019","0","","","plos_001","PLOS ONE — Social Development in Homeschooled vs. Traditionally Schooled Children","https://journals.plos.org/plosone/article?id=10.1371/journal.pone.0177391","PLOS ONE","peer_reviewed","A","2016","2017-05-31"
"The major tuna fishing gears within the entire Indian Ocean (both tropical and temperate) are purse seine (26% of tuna catch during 2015), gillnet (33%), longline (16%) and pole-and-line (6%), with the balance taken by minor gears or unrecorded gear types (tuna and effort catch data from www.iotc.org , accessed January 2017).","26.0","%","","","1","neutral","2012_2019","0","","","plos_001","PLOS ONE — Social Development in Homeschooled vs. Traditionally Schooled Children","https://journals.plos.org/plosone/article?id=10.1371/journal.pone.0177391","PLOS ONE","peer_reviewed","A","2016","2017-05-31"
"The Maldives boasts the highest per capita fish consumption in the world [ 21 ], with over half of all fish caught consumed locally rather than exported (53%, or 64,000 t in 2012) [ 22 ].","53.0","%","","","1","neutral","2012_2019","0","","","plos_001","PLOS ONE — Social Development in Homeschooled vs. Traditionally Schooled Children","https://journals.plos.org/plosone/article?id=10.1371/journal.pone.0177391","PLOS ONE","peer_reviewed","A","2016","2017-05-31"
"Species other than tunas (primarily rainbow runner, silky shark [ Carcharhinus falciformis ] and dolphinfish [ Coryphaena hippurus ]) probably contributed ‘less than 5% of the total catch’ from the pole-and-line fishery [ 26 ].","5.0","%","","","1","neutral","2012_2019","0","","","plos_001","PLOS ONE — Social Development in Homeschooled vs. Traditionally Schooled Children","https://journals.plos.org/plosone/article?id=10.1371/journal.pone.0177391","PLOS ONE","peer_reviewed","A","2016","2017-05-31"
"Approximately 50% of the Maldivian pole-and-line tuna catch is currently taken from these aFADs [ 39 ], up from an estimated 44% in the early 1990s [ 40 ].","50.0","%","","","1","neutral","2012_2019","0","","","plos_001","PLOS ONE — Social Development in Homeschooled vs. Traditionally Schooled Children","https://journals.plos.org/plosone/article?id=10.1371/journal.pone.0177391","PLOS ONE","peer_reviewed","A","2016","2017-05-31"
"Fishing events were defined as periods of active fishing that were separated by more than 10 minutes.","10.0","count","","","1","neutral","2012_2019","0","","","plos_001","PLOS ONE — Social Development in Homeschooled vs. Traditionally Schooled Children","https://journals.plos.org/plosone/article?id=10.1371/journal.pone.0177391","PLOS ONE","peer_reviewed","A","2016","2017-05-31"
"The main tuna species taken were skipjack (72.3% of the tuna catch by weight) and yellowfin (25.0%), with bigeye, kawakawa, and frigate tuna together making up the balance (2.7%) ( Table 2 ).","72.3","%","","","1","neutral","2012_2019","0","","","plos_001","PLOS ONE — Social Development in Homeschooled vs. Traditionally Schooled Children","https://journals.plos.org/plosone/article?id=10.1371/journal.pone.0177391","PLOS ONE","peer_reviewed","A","2016","2017-05-31"
"That was 0.65% of the tuna landings, or 0.64% of all catch and bycatch.","0.65","%","","","1","neutral","2012_2019","0","","","plos_001","PLOS ONE — Social Development in Homeschooled vs. Traditionally Schooled Children","https://journals.plos.org/plosone/article?id=10.1371/journal.pone.0177391","PLOS ONE","peer_reviewed","A","2016","2017-05-31"
"Bycatch was taken in just 5.4% of all free school fishing events, but in 52% of all associated school fishing events.","5.4","%","","","1","neutral","2012_2019","0","","","plos_001","PLOS ONE — Social Development in Homeschooled vs. Traditionally Schooled Children","https://journals.plos.org/plosone/article?id=10.1371/journal.pone.0177391","PLOS ONE","peer_reviewed","A","2016","2017-05-31"
"Furthermore, bycatch from free schools was only 0.02% of the tuna catch by weight, whereas from associated schools it was 1.21%, and the bycatch rate was significantly higher at all associated schools (U = 995.5, p <0.0001).","0.02","%","","","1","neutral","2012_2019","0","","","plos_001","PLOS ONE — Social Development in Homeschooled vs. Traditionally Schooled Children","https://journals.plos.org/plosone/article?id=10.1371/journal.pone.0177391","PLOS ONE","peer_reviewed","A","2016","2017-05-31"
"Note that 55% of the fishing events (and 33% of catch) occurred at aFADs ( Table 1 ).","55.0","%","","","1","neutral","2012_2019","0","","","plos_001","PLOS ONE — Social Development in Homeschooled vs. Traditionally Schooled Children","https://journals.plos.org/plosone/article?id=10.1371/journal.pone.0177391","PLOS ONE","peer_reviewed","A","2016","2017-05-31"
"https://doi.org/10.1371/journal.pone.0177391.t005 Ninety-five percent (95%) by weight of the bycatch was retained for sale or consumption, i.e.","95.0","%","","","1","neutral","2012_2019","0","","","plos_001","PLOS ONE — Social Development in Homeschooled vs. Traditionally Schooled Children","https://journals.plos.org/plosone/article?id=10.1371/journal.pone.0177391","PLOS ONE","peer_reviewed","A","2016","2017-05-31"
