"stat_text","numeric_value","unit","value_type","sample_size","category_id","sentiment","era","selection_bias_flag","semantic_cluster","conflicts_with","source_id","source_title","source_url","source_publisher","credibility_tier","methodology_grade","data_collection_year","published_date"
"Live releases amounted to 0.01% of the tuna catch or 2% of bycatch, while dead discards were 0.02% of the tuna catch (3% of bycatch).","0.01","%","","","1","neutral","2012_2019","0","","","plos_001","PLOS ONE — Social Development in Homeschooled vs. Traditionally Schooled Children","https://journals.plos.org/plosone/article?id=10.1371/journal.pone.0177391","PLOS ONE","peer_reviewed","A","2016","2017-05-31"
"Discards amounted to 32 kg, equivalent to 22 kg per 100 t of tuna catch, or 0.02% of tuna catch.","0.02","%","","","1","neutral","2012_2019","0","","","plos_001","PLOS ONE — Social Development in Homeschooled vs. Traditionally Schooled Children","https://journals.plos.org/plosone/article?id=10.1371/journal.pone.0177391","PLOS ONE","peer_reviewed","A","2016","2017-05-31"
"https://doi.org/10.1371/journal.pone.0177391.t008 Discussion The bycatch rate recorded here (0.65% of the tuna catch) is very similar to that recorded from western Pacific pole-and-line tuna fisheries.","0.65","%","","","1","neutral","2012_2019","0","","","plos_001","PLOS ONE — Social Development in Homeschooled vs. Traditionally Schooled Children","https://journals.plos.org/plosone/article?id=10.1371/journal.pone.0177391","PLOS ONE","peer_reviewed","A","2016","2017-05-31"
"In a review of the limited and scattered literature, average bycatch was estimated at 0.8% of the total catch for western Pacific pole-and-line skipjack fisheries, with rainbow runner and dolphinfish being the most frequently taken bycatch species [ 43 ].","0.8","%","","","1","neutral","2012_2019","0","","","plos_001","PLOS ONE — Social Development in Homeschooled vs. Traditionally Schooled Children","https://journals.plos.org/plosone/article?id=10.1371/journal.pone.0177391","PLOS ONE","peer_reviewed","A","2016","2017-05-31"
"Observer data from the Solomon Islands gave an estimated bycatch of 0.6% of the pole-and-line tuna catch, with rainbow runner and dolphinfish again being the most frequently taken bycatch species [ 44 ].","0.6","%","","","1","neutral","2012_2019","0","","","plos_001","PLOS ONE — Social Development in Homeschooled vs. Traditionally Schooled Children","https://journals.plos.org/plosone/article?id=10.1371/journal.pone.0177391","PLOS ONE","peer_reviewed","A","2016","2017-05-31"
"In Indonesia, bycatch was estimated at 1% in small-scale tuna pole-and-line fisheries [ 4 ].","1.0","%","","","1","neutral","2012_2019","0","","","plos_001","PLOS ONE — Social Development in Homeschooled vs. Traditionally Schooled Children","https://journals.plos.org/plosone/article?id=10.1371/journal.pone.0177391","PLOS ONE","peer_reviewed","A","2016","2017-05-31"
"In a global review, a mean discard rate of 0.4% from tuna pole-and-line fisheries was estimated [ 15 ].","0.4","%","","","1","neutral","2012_2019","0","","","plos_001","PLOS ONE — Social Development in Homeschooled vs. Traditionally Schooled Children","https://journals.plos.org/plosone/article?id=10.1371/journal.pone.0177391","PLOS ONE","peer_reviewed","A","2016","2017-05-31"
"Indeed, purse seine bycatch ranged from a low of 0.9% for seamount-associated schools in the Indian Ocean [ 9 ] to 15.0% for FAD-associated schools in the Atlantic [ 55 ].","0.9","%","","","1","neutral","2012_2019","0","","","plos_001","PLOS ONE — Social Development in Homeschooled vs. Traditionally Schooled Children","https://journals.plos.org/plosone/article?id=10.1371/journal.pone.0177391","PLOS ONE","peer_reviewed","A","2016","2017-05-31"
"One exception to this standard practice was provided by [ 25 ], wherein livebait was included in bycatch estimates for the Maldivian pole-and-line fishery and, based on published information from MRC, noted bycatch at 11.6% of the tuna catch.","11.6","%","","","1","neutral","2012_2019","0","","","plos_001","PLOS ONE — Social Development in Homeschooled vs. Traditionally Schooled Children","https://journals.plos.org/plosone/article?id=10.1371/journal.pone.0177391","PLOS ONE","peer_reviewed","A","2016","2017-05-31"
"That was equivalent to 8.9% of the tuna catch, or 11.3 kg of tuna per 1 kg of livebait caught.","8.9","%","","","1","neutral","2012_2019","0","","","plos_001","PLOS ONE — Social Development in Homeschooled vs. Traditionally Schooled Children","https://journals.plos.org/plosone/article?id=10.1371/journal.pone.0177391","PLOS ONE","peer_reviewed","A","2016","2017-05-31"
"This is comparable to, but slightly more efficient than, catch rates estimated by previous Maldives studies (summarised in [ 36 ]), which reported catches within the range of 7.4–10.0 kg of tuna per 1 kg of livebait used, or 10.0–13.5% of tuna catch.","13.5","%","","","1","neutral","2012_2019","0","","","plos_001","PLOS ONE — Social Development in Homeschooled vs. Traditionally Schooled Children","https://journals.plos.org/plosone/article?id=10.1371/journal.pone.0177391","PLOS ONE","peer_reviewed","A","2016","2017-05-31"
"Skipjack made up nearly all (98%) the tuna catch from free schools but only half (51%) from associated schools.","98.0","%","","","1","neutral","2012_2019","0","","","plos_001","PLOS ONE — Social Development in Homeschooled vs. Traditionally Schooled Children","https://journals.plos.org/plosone/article?id=10.1371/journal.pone.0177391","PLOS ONE","peer_reviewed","A","2016","2017-05-31"
"Also, across the entire study, skipjack contributed 72.3% to the total tuna catch, which is close to the long-term estimated average for the national fishery of 75% [ 59 ].","72.3","%","","","1","neutral","2012_2019","0","","","plos_001","PLOS ONE — Social Development in Homeschooled vs. Traditionally Schooled Children","https://journals.plos.org/plosone/article?id=10.1371/journal.pone.0177391","PLOS ONE","peer_reviewed","A","2016","2017-05-31"
"In this study, the proportion of bigeye in the Thunnus component of the pole-and-line catch was estimated at 6.1%, but with a higher proportion in the south (7.3%) than the north (2.7%) ( S7 Table ).","6.1","%","","","1","neutral","2012_2019","0","","","plos_001","PLOS ONE — Social Development in Homeschooled vs. Traditionally Schooled Children","https://journals.plos.org/plosone/article?id=10.1371/journal.pone.0177391","PLOS ONE","peer_reviewed","A","2016","2017-05-31"
"In neighbouring Sri Lanka, inspection of ‘small yellowfin’ landings at Beruwela (6°29’N, the same latitude as Shaviyani Atoll in the north of Maldives) found 0.7% bigeye [ 64 ].","0.7","%","","","1","neutral","2012_2019","0","","","plos_001","PLOS ONE — Social Development in Homeschooled vs. Traditionally Schooled Children","https://journals.plos.org/plosone/article?id=10.1371/journal.pone.0177391","PLOS ONE","peer_reviewed","A","2016","2017-05-31"
"Comparison with other fisheries In comparison to other fisheries, a bycatch rate of 0.5%-1% is very low.","0.5","%","","","1","neutral","2012_2019","0","","","plos_001","PLOS ONE — Social Development in Homeschooled vs. Traditionally Schooled Children","https://journals.plos.org/plosone/article?id=10.1371/journal.pone.0177391","PLOS ONE","peer_reviewed","A","2016","2017-05-31"
"For example, there are estimates of global average bycatch from shrimp trawl of 62%, tuna longline of 28%, and tuna purse seine at 5% [ 15 ].","62.0","%","","","1","neutral","2012_2019","0","","","plos_001","PLOS ONE — Social Development in Homeschooled vs. Traditionally Schooled Children","https://journals.plos.org/plosone/article?id=10.1371/journal.pone.0177391","PLOS ONE","peer_reviewed","A","2016","2017-05-31"
"In 2015, reported catches for tuna and tuna-like species were 534,000 t for gillnet (33% of the total), 415,000 t for purse seine (26%) and 260,000 t for longline (16%), compared to 102,000 t for pole-and-line (6%) (catch data from www.iotc.org , accessed January 2017).","33.0","%","","","1","neutral","2012_2019","0","","","plos_001","PLOS ONE — Social Development in Homeschooled vs. Traditionally Schooled Children","https://journals.plos.org/plosone/article?id=10.1371/journal.pone.0177391","PLOS ONE","peer_reviewed","A","2016","2017-05-31"
"However, recent research in Pakistan, which incorporated observer data, reported bycatch amounting roughly 40% of tuna landings [ 67 , 68 ].","40.0","%","","","1","neutral","2012_2019","0","","","plos_001","PLOS ONE — Social Development in Homeschooled vs. Traditionally Schooled Children","https://journals.plos.org/plosone/article?id=10.1371/journal.pone.0177391","PLOS ONE","peer_reviewed","A","2016","2017-05-31"
"For these fleets, bycatch was sampled during 2003–2009 by onboard observers, and estimated at 11,590 t per year, which was 4.7% of tuna landings [ 69 ].","4.7","%","","","1","neutral","2012_2019","0","","","plos_001","PLOS ONE — Social Development in Homeschooled vs. Traditionally Schooled Children","https://journals.plos.org/plosone/article?id=10.1371/journal.pone.0177391","PLOS ONE","peer_reviewed","A","2016","2017-05-31"
"Nevertheless, if 4.7% were representative of all Indian Ocean tuna purse seine fisheries, then it would suggest bycatch of over 20,000 t in 2015.","4.7","%","","","1","neutral","2012_2019","0","","","plos_001","PLOS ONE — Social Development in Homeschooled vs. Traditionally Schooled Children","https://journals.plos.org/plosone/article?id=10.1371/journal.pone.0177391","PLOS ONE","peer_reviewed","A","2016","2017-05-31"
"However, a large study of bycatch on Taiwanese tuna longliners which covered much of the Indian Ocean found that bycatch and discards comprised 35.8% of total catch [ 13 ].","35.8","%","","","1","neutral","2012_2019","0","","","plos_001","PLOS ONE — Social Development in Homeschooled vs. Traditionally Schooled Children","https://journals.plos.org/plosone/article?id=10.1371/journal.pone.0177391","PLOS ONE","peer_reviewed","A","2016","2017-05-31"
"And for the European purse seine fishery, it was reported that tuna discards accounted for 54% of all bycatch [ 9 ].","54.0","%","","","1","neutral","2012_2019","0","","","plos_001","PLOS ONE — Social Development in Homeschooled vs. Traditionally Schooled Children","https://journals.plos.org/plosone/article?id=10.1371/journal.pone.0177391","PLOS ONE","peer_reviewed","A","2016","2017-05-31"
"In comparison, longline tuna fishing can have high mortality rates of discarded fishes: 38–63% discarded dead for Taiwanese tuna longline fisheries [ 13 ], and 59% discarded dead for western-central Pacific longline fisheries [ 44 ].","63.0","%","","","1","neutral","2012_2019","0","","","plos_001","PLOS ONE — Social Development in Homeschooled vs. Traditionally Schooled Children","https://journals.plos.org/plosone/article?id=10.1371/journal.pone.0177391","PLOS ONE","peer_reviewed","A","2016","2017-05-31"
"In one study for Indian Ocean purse seine fishery, over 50% of the silky sharks brought on board in purse seine operations and released alive subsequently died, raising the total mortality rate of brailed sharks to 85% [ 79 ].","50.0","%","","","1","neutral","2012_2019","0","","","plos_001","PLOS ONE — Social Development in Homeschooled vs. Traditionally Schooled Children","https://journals.plos.org/plosone/article?id=10.1371/journal.pone.0177391","PLOS ONE","peer_reviewed","A","2016","2017-05-31"
"FADs & unobserved mortalities As noted above, the Maldivian pole-and-line fishery makes full use of the network of approximately 50 aFADs deployed around the atolls [ 81 , 82 ].","50.0","count","","","1","neutral","2012_2019","0","","","plos_001","PLOS ONE — Social Development in Homeschooled vs. Traditionally Schooled Children","https://journals.plos.org/plosone/article?id=10.1371/journal.pone.0177391","PLOS ONE","peer_reviewed","A","2016","2017-05-31"
"In the western Indian Ocean purse seine fisheries, very high numbers of dFADs are employed: more than 7,600 dFADs were estimated to have been deployed in the Indian Ocean in 2009 [ 83 ], and 6,700 active dFADs were deployed by the French and Spanish purse seine fleets in the western Indian Ocean at the end of 2013 [ 84 ].","7600.0","count","","","1","neutral","2012_2019","0","","","plos_001","PLOS ONE — Social Development in Homeschooled vs. Traditionally Schooled Children","https://journals.plos.org/plosone/article?id=10.1371/journal.pone.0177391","PLOS ONE","peer_reviewed","A","2016","2017-05-31"
"The number of Maldivian aFADs is less than 1% of the number of dFADs deployed by the western Indian Ocean purse seine fisheries.","1.0","%","","","1","neutral","2012_2019","0","","","plos_001","PLOS ONE — Social Development in Homeschooled vs. Traditionally Schooled Children","https://journals.plos.org/plosone/article?id=10.1371/journal.pone.0177391","PLOS ONE","peer_reviewed","A","2016","2017-05-31"
"However, the Maldivian pole-and-line fishery has few discards, since most (95%) of the non-tuna catch is edible and is utilised.","95.0","%","","","1","neutral","2012_2019","0","","","plos_001","PLOS ONE — Social Development in Homeschooled vs. Traditionally Schooled Children","https://journals.plos.org/plosone/article?id=10.1371/journal.pone.0177391","PLOS ONE","peer_reviewed","A","2016","2017-05-31"
